id,text,class,notesCleaned,classification_int,max_count,tokens,token_count,limit
18,"My life is over at 20 years oldHello all. I am a 20 year old balding male. My hairline is trash and to make matters worse my head is HUGE. I have bipolar, depression and crippling social anxiety. Balding has been the cherry on top. I wear a hat 24/7 even in my room when I’m alone because I can’t stop thinking about it. I pop Xanax all day to try and numb the pain and it works for a little bit but it all comes crashing back twice as hard once I come down. I don’t know how to communicate with people anymore and I don’t know how to keep a relationship. I used to be one of the “popular kids” but after my dad passed away I feel into a deep dark hole. I’ve been arrested numerous times, been in rehab, mental hospitals, you name it. The only reason I haven’t killed myself yet is because of my mom and brothers. If I didn’t have them I’d be dead long ago. But it’s getting to the point where even their love and support isn’t going to be enough to keep me alive anymore. I’m either going to be the guy who killed himself, or the guy who went bald and 20 and looks like a child molestor. Which one would you choose?",suicide,"my life is over at 20 years old hello all i am a 20 year old balding male my hairline is trash and to make matters worse my head is huge i have bipolar, depression and crippling social anxiety balding has been the cherry on top i wear a hat 24/7 even in my room when im alone because i cant stop thinking about it i pop xanax all day to try and numb the pain and it works for a little bit but it all comes crashing back twice as hard once i come down i dont know how to communicate with people anymore and i dont know how to keep a relationship i used to be one of the popular kids but after my dad passed away i feel into a deep dark hole ive been arrested numerous times, been in rehab, mental hospitals, you name it the only reason i havent killed myself yet is because of my mom and brothers if i didnt have them id be dead long ago but its getting to the point where even their love and support isnt going to be enough to keep me alive anymore im either going to be the guy who killed himself, or the guy who went bald and 20 and looks like a child molestor which one would you choose?",1.0,492,"[101, 2026, 2166, 2003, 2058, 2012, 2322, 2086, 2214, 7592, 2035, 1045, 2572, 1037, 2322, 2095, 2214, 13852, 2075, 3287, 2026, 2606, 4179, 2003, 11669, 1998, 2000, 2191, 5609, 4788, 2026, 2132, 2003, 4121, 1045, 2031, 29398, 1010, 6245, 1998, 13675, 11514, 14353, 2591, 10089, 13852, 2075, 2038, 2042, 1996, 9115, 2006, 2327, 1045, 4929, 1037, 6045, 2484, 1013, 1021, 2130, 1999, 2026, 2282, 2043, 10047, 2894, 2138, 1045, 2064, 2102, 2644, 3241, 2055, 2009, 1045, 3769, 1060, 5162, 2595, 2035, 2154, 2000, 3046, 1998, 15903, 1996, 3255, 1998, 2009, 2573, 2005, 1037, 2210, 2978, 2021, 2009, 2035, 3310, 12894, 2067, 3807, 2004, 2524, 2320, 1045, 2272, 2091, 1045, 2123, 2102, 2113, 2129, 2000, 10639, 2007, 2111, 4902, 1998, 1045, 2123, 2102, 2113, 2129, 2000, 2562, 1037, 3276, 1045, 2109, 2000, 2022, 2028, 1997, 1996, 2759, 4268, 2021, 2044, 2026, 3611, 2979, 2185, 1045, 2514, 2046, 1037, 2784, 2601, 4920, 4921, 2063, 2042, 4727, 3365, 2335, 1010, 2042, 1999, 24497, 1010, 5177, 8323, 1010, 2017, 2171, 2009, 1996, 2069, 3114, 1045, 4033, 2102, 2730, 2870, 2664, 2003, 2138, 1997, 2026, 3566, 1998, 3428, 2065, 1045, 2134, 2102, 2031, 2068, 8909, 2022, 2757, 2146, 3283, 2021, 2049, 2893, 2000, 1996, 2391, 2073, 2130, 2037, 2293, 1998, 2490, 3475, 2102, 2183, 2000, 2022, 2438, 2000, 2562, 2033, 4142, 4902, 10047, 2593, 2183, 2000, 2022, 1996, 3124, 2040, 2730, 2370, 1010, 2030, 1996, 3124, 2040, 2253, 13852, 1998, 2322, 1998, 3504, 2066, 1037, 2775, 16709, 23809, 2029, 2028, 2052, 2017, 5454, 1029, 102]",250,0
19,"I took the rest of my sleeping pills and my painkillersI can’t wait for it to end, I’ve struggled for the past 6 years and I’m finally ending it.",suicide,"i took the rest of my sleeping pills and my painkillers i cant wait for it to end, ive struggled for the past 6 years and im finally ending it ",1.0,492,"[101, 1045, 2165, 1996, 2717, 1997, 2026, 5777, 15345, 1998, 2026, 3255, 15872, 2545, 1045, 2064, 2102, 3524, 2005, 2009, 2000, 2203, 1010, 4921, 2063, 6915, 2005, 1996, 2627, 1020, 2086, 1998, 10047, 2633, 4566, 2009, 102]",37,0
20,"Can you imagine getting old? Me neither.Wrinkles, weight gain, hair loss, messed up teeth and bones, health issues, menopause, hormones, hating new generations &amp; the way world progress.

Being a useless angry piece of shit who can't take care of itself. Being totally depended on people who secretly wants you to die already.

Can you even imagine yourself there? Absolutely not. Even if I was happy, I'd take my life just to avoid this. ",suicide,"can you imagine getting old? me neither wrinkles, weight gain, hair loss, messed up teeth and bones, health issues, menopause, hormones, hating new generations amp the way world progress  being a useless angry piece of shit who can t take care of itself being totally depended on people who secretly wants you to die already  can you even imagine yourself there? absolutely not even if i was happy, i d take my life just to avoid this ",1.0,492,"[101, 2064, 2017, 5674, 2893, 2214, 1029, 2033, 4445, 23277, 28562, 1010, 3635, 5114, 1010, 2606, 3279, 1010, 18358, 2039, 4091, 1998, 5944, 1010, 2740, 3314, 1010, 2273, 29477, 8557, 1010, 20752, 1010, 22650, 2047, 8213, 23713, 1996, 2126, 2088, 5082, 2108, 1037, 11809, 4854, 3538, 1997, 4485, 2040, 2064, 1056, 2202, 2729, 1997, 2993, 2108, 6135, 17292, 2006, 2111, 2040, 10082, 4122, 2017, 2000, 3280, 2525, 2064, 2017, 2130, 5674, 4426, 2045, 1029, 7078, 2025, 2130, 2065, 1045, 2001, 3407, 1010, 1045, 1040, 2202, 2026, 2166, 2074, 2000, 4468, 2023, 102]",92,0
21,"Do you think getting hit by a train would be painful?Guns are hard to come by in my country but trains are not. I just don't want to suffer though, do you think this would be a painless method of suicide?",suicide,"do you think getting hit by a train would be painful? guns are hard to come by in my country but trains are not i just don t want to suffer though, do you think this would be a painless method of suicide?",1.0,492,"[101, 2079, 2017, 2228, 2893, 2718, 2011, 1037, 3345, 2052, 2022, 9145, 1029, 4409, 2024, 2524, 2000, 2272, 2011, 1999, 2026, 2406, 2021, 4499, 2024, 2025, 1045, 2074, 2123, 1056, 2215, 2000, 9015, 2295, 1010, 2079, 2017, 2228, 2023, 2052, 2022, 1037, 3255, 3238, 4118, 1997, 5920, 1029, 102]",49,0
22,"death, continuedI posted here before and saw something interesting.  I asked for information.  You know what I got back?  A bunch of people who wanted to do the same thing to me as they always do: spit back personal information about me.  This makes things worse, obviously, but at least a bunch of trolls are having laughs.

In the end, my desire to self-terminate grows stronger.  I have so little left now, but still have the same bitterness, just a bit stronger now.  The main goal throughout the process is to minimize the subsequent fallout.  It would certainly have been nice had the patrons of this forum been more respectful of my privacy, but that was obviously a bit of a ridiculous expectation, considering the source.",suicide,"death, continued i posted here before and saw something interesting  i asked for information  you know what i got back? a bunch of people who wanted to do the same thing to me as they always do spit back personal information about me  this makes things worse, obviously, but at least a bunch of trolls are having laughs  in the end, my desire to self terminate grows stronger  i have so little left now, but still have the same bitterness, just a bit stronger now  the main goal throughout the process is to minimize the subsequent fallout  it would certainly have been nice had the patrons of this forum been more respectful of my privacy, but that was obviously a bit of a ridiculous expectation, considering the source ",1.0,492,"[101, 2331, 1010, 2506, 1045, 6866, 2182, 2077, 1998, 2387, 2242, 5875, 1045, 2356, 2005, 2592, 2017, 2113, 2054, 1045, 2288, 2067, 1029, 1037, 9129, 1997, 2111, 2040, 2359, 2000, 2079, 1996, 2168, 2518, 2000, 2033, 2004, 2027, 2467, 2079, 13183, 2067, 3167, 2592, 2055, 2033, 2023, 3084, 2477, 4788, 1010, 5525, 1010, 2021, 2012, 2560, 1037, 9129, 1997, 27980, 2024, 2383, 11680, 1999, 1996, 2203, 1010, 2026, 4792, 2000, 2969, 20320, 7502, 6428, 1045, 2031, 2061, 2210, 2187, 2085, 1010, 2021, 2145, 2031, 1996, 2168, 22364, 1010, 2074, 1037, 2978, 6428, 2085, 1996, 2364, 3125, 2802, 1996, 2832, 2003, 2000, 18478, 1996, 4745, 23902, 2009, 2052, 5121, 2031, 2042, 3835, 2018, 1996, 13497, 1997, 2023, 7057, 2042, 2062, 26438, 1997, 2026, 9394, 1010, 2021, 2008, 2001, 5525, 1037, 2978, 1997, 1037, 9951, 17626, 1010, 6195, 1996, 3120, 102]",139,0
23,Been arrested - feeling suicidalEdit,suicide,been arrested  feeling suicidal edit,1.0,492,"[101, 2042, 4727, 3110, 26094, 10086, 102]",7,0
24,Fuck the verizon smart family app I can’t even watch porn privately anymore wtf why is that a feature,non-suicide,fuck the verizon smart family app i cant even watch porn privately anymore wtf why is that a feature,0.0,492,"[101, 6616, 1996, 2310, 21885, 2239, 6047, 2155, 10439, 1045, 2064, 2102, 2130, 3422, 22555, 9139, 4902, 1059, 24475, 2339, 2003, 2008, 1037, 3444, 102]",25,0
25,"I’m scared.   Everything just seems to be getting worse and worse. I’m young and I think I’m transgender but I’m not even sure about that. I can’t tell if I’m just lying to myself or if I’m actually trans, I feel so overwhelmed with thoughts and emotions and I can’t just take it anymore.
    I just wish I could at least know for sure if I was trans, and even then I have to worry about if my (religious) family will be accepting and if I can actually do anything to alleviate my pain a bit.
   I cut myself for the first time yesterday, I barely even drew blood so I can’t even fucking hurt myself correctly. I don’t think I’ll ever be able to do anything correctly, I want to pursue music but I know there’s no money to be found in that field unless I become famous but that’s not happening. 
   Currently I’m not seriously debating suicide but the thoughts keep coming back and they just keep getting worse. I’m not sure if I can really take this much longer, I just wish I was born a girl. I want to cry.",suicide,"im scared  everything just seems to be getting worse and worse im young and i think im transgender but im not even sure about that i cant tell if im just lying to myself or if im actually trans, i feel so overwhelmed with thoughts and emotions and i cant just take it anymore  i just wish i could at least know for sure if i was trans, and even then i have to worry about if my religious family will be accepting and if i can actually do anything to alleviate my pain a bit   i cut myself for the first time yesterday, i barely even drew blood so i cant even fucking hurt myself correctly i dont think ill ever be able to do anything correctly, i want to pursue music but i know theres no money to be found in that field unless i become famous but thats not happening   currently im not seriously debating suicide but the thoughts keep coming back and they just keep getting worse im not sure if i can really take this much longer, i just wish i was born a girl i want to cry ",1.0,492,"[101, 10047, 6015, 2673, 2074, 3849, 2000, 2022, 2893, 4788, 1998, 4788, 10047, 2402, 1998, 1045, 2228, 10047, 16824, 2021, 10047, 2025, 2130, 2469, 2055, 2008, 1045, 2064, 2102, 2425, 2065, 10047, 2074, 4688, 2000, 2870, 2030, 2065, 10047, 2941, 9099, 1010, 1045, 2514, 2061, 13394, 2007, 4301, 1998, 6699, 1998, 1045, 2064, 2102, 2074, 2202, 2009, 4902, 1045, 2074, 4299, 1045, 2071, 2012, 2560, 2113, 2005, 2469, 2065, 1045, 2001, 9099, 1010, 1998, 2130, 2059, 1045, 2031, 2000, 4737, 2055, 2065, 2026, 3412, 2155, 2097, 2022, 10564, 1998, 2065, 1045, 2064, 2941, 2079, 2505, 2000, 24251, 2026, 3255, 1037, 2978, 1045, 3013, 2870, 2005, 1996, 2034, 2051, 7483, 1010, 1045, 4510, 2130, 3881, 2668, 2061, 1045, 2064, 2102, 2130, 8239, 3480, 2870, 11178, 1045, 2123, 2102, 2228, 5665, 2412, 2022, 2583, 2000, 2079, 2505, 11178, 1010, 1045, 2215, 2000, 7323, 2189, 2021, 1045, 2113, 2045, 2015, 2053, 2769, 2000, 2022, 2179, 1999, 2008, 2492, 4983, 1045, 2468, 3297, 2021, 2008, 2015, 2025, 6230, 2747, 10047, 2025, 5667, 20767, 5920, 2021, 1996, 4301, 2562, 2746, 2067, 1998, 2027, 2074, 2562, 2893, 4788, 10047, 2025, 2469, 2065, 1045, 2064, 2428, 2202, 2023, 2172, 2936, 1010, 1045, 2074, 4299, 1045, 2001, 2141, 1037, 2611, 1045, 2215, 2000, 5390, 102]",207,0
26,"Well, Im screwed. I locked myself in the school toilet, and can't get out. For now.

Edit: I'm out now, I lived to tell the story",non-suicide,"well, im screwed i locked myself in the school toilet, and can't get out for now  edit i m out now, i lived to tell the story",0.0,492,"[101, 2092, 1010, 10047, 14180, 1045, 5299, 2870, 1999, 1996, 2082, 11848, 1010, 1998, 2064, 1005, 1056, 2131, 2041, 2005, 2085, 10086, 1045, 1049, 2041, 2085, 1010, 1045, 2973, 2000, 2425, 1996, 2466, 102]",34,0
27,"I'm fucked assignment is due tomorrow and I haven't even started yet. 

:)",non-suicide,i m fucked assignment is due tomorrow and i haven t even started yet   ,0.0,492,"[101, 1045, 1049, 21746, 8775, 2003, 2349, 4826, 1998, 1045, 4033, 1056, 2130, 2318, 2664, 102]",16,0
